company_id,name,link,bse,nse,industry,sector,about
NSE - SM : TARACHAND,Tara Chand Logistic Solutions Ltd,Company website,NSE - SM : TARACHAND,,Miscellaneous,Logistics,"Tara Chand Logistic Solutions is engaged in Sale of Products, Handling & Transportation, Tangible Goods Services."
524675,Kabsons Industries Ltd,kabsonsindustrieslimited.com,524675,,Trading,Trading,"Kabsons Industries engages in the business of manufacturing, refining and dealing in all types of Petrochemicals, chemicals used in Petroleum Industry their Products, by-products and derivatives and fractioning, Compounding, reacting and liquefying all hydrocarbon gases and solids of liquids and produce all types of intermediate, finished and waste products for self use or sale."
506579,Oriental Carbon & Chemicals Ltd,occlindia.com,506579,OCCL,Chemicals,Chemicals,Oriental Carbon & Chemicals is manufacturing and sales of Insoluble Sulphur. The Company is a global supplier of Insoluble Sulphur of which about two-third of the turnover is from Exports.
530401,Vinyoflex Ltd,vinyoflex.com,530401,,Plastics Products,Plastic products,Vinyoflex is engaged in PVC Sheetings (Vinyl films).
500403,Sundram Fasteners Ltd,sundram.com,500403,SUNDRMFAST,Fasteners,"Castings, Forgings & Fastners","Sundram Fasteners is primarily engaged in business of manufacture and sale of bolts and nuts, water and oil pumps, sintered products, cold extruded components, hot & warm forged parts, radiator caps and other parts which has applications mainly in automobile industry."
532706,Inox Leisure Ltd,inoxmovies.com,532706,INOXLEISUR,Entertainment / Electronic Media Software,Entertainment,Inox Leisure is engaged in operating & managing multiplexes and cinema theatres in India.
523025,Safari Industries (India) Ltd,safari.in,523025,SAFARI,Moulded Luggage,Plastic products,Safari Industries (India) is engaged in the Business of Hard and Soft Luggage.
526729,Goldiam International Ltd,goldiam.com,526729,GOLDIAM,Diamond Cutting / Jewellery,"Diamond, Gems and Jewellery",Goldiam International is engaged in the business of Manufacturers and exporters of studded gold and silver jewellery.
504084,Kaycee Industries Ltd,kayceeinduatries.com,504084,,Electric Equipment,Capital Goods - Electrical Equipment,"Kaycee Industries is a manufacturing and trading company in the field of Industrial switches, Counters, Watermeter, Electrical Components Etc."
532811,Ahluwalia Contracts (India) Ltd,acilnet.com,532811,AHLUCONT,Construction,Realty,Ahluwalia Contracts (India) is engaged in the business of construction activities.(Source : 201903 Annual Report Page No:17)
NSE - BE : MAHESHWARI,Maheshwari Logistics Ltd,Company website,NSE - BE : MAHESHWARI,,Miscellaneous,Logistics,Maheshwari Logistics is an India-based company engaged in the business of logistic services and trading of coal.
NSE - BE : GEEKAYWIRE,Geekay Wires Ltd,Company website,NSE - BE : GEEKAYWIRE,,Cables - Power,Cables,"Geekay Wires has been in the business of manufacturing high quality galvanized steel wires and wire products and have been meeting the requirement of various clients in the government and private sectors like power, construction ,automobile, general engineering and domestic segments."
500387,Shree Cement Ltd,shreecement.com/,500387,SHREECEM,Cement - North India,Cement,Shree Cement is engaged in the manufacturing and selling of cement and cement related products. It is recognized as one of the most efficient and environment friendly company in the global cement industry.(Source : 202003 Annual Report Page No: 126)
530377,Nila Infrastructures Ltd,nilainfra.com,530377,NILAINFRA,Construction,Construction,Nila Infrastructures is engaged in the business of Construction of Buildings Carried out on own account basis or on a fee or contract basis.
NSE - SM : PAR,Par Drugs & Chemicals Ltd,Company website,NSE - SM : PAR,,Pharmaceuticals - Indian - Bulk Drugs,Pharmaceuticals,"Par Drugs & Chemicals is primarily engaged in manufacturing of Active Pharma Ingredients and fine chemicals (API) for domestic market as well as for exports to international markets. APIs, also known as bulk drugs or bulk actives are the principal in"
531069,Vijay Solvex Ltd,dataoils.com,531069,,Solvent Extraction,Edible Oil,Vijay Solvex is engaged in a leading manufacturer/producer of Edible Oil and vanaspati ghee. The company is also diversified into ceramics products and wind power.
533284,RPP Infra Projects Ltd,rppipl.com,533284,RPPINFRA,Construction,Construction,"R.P.P Infra Projects Limited is engaged in engineering and construction activities. The Company is engaged in the business of construction and infrastructure development, such as civil construction work for irrigation and water supply projects and power plants"
524774,NGL Fine Chem Ltd,nglfinechem.com,524774,,Pharmaceuticals - Indian - Bulk Drugs,Pharmaceuticals,NGL Fine Chem is engaged in the Business of Chemical substances used in manufacture of pharmaceuticals and Allopathic medicines.
526227,Filatex India Ltd,filatex.com,526227,FILATEX,Textiles - Manmade,Textiles,"Filatex India Limited is engaged in manufacture and trading of synthetic yarn and textiles. The Company manufactures polyester and polypropylene multifilament yarn, and polyester chips."
543238,UTI Asset Management Company Ltd,utimf.com,543238,UTIAMC,Finance & Investments,Finance,Finance >> Finance & Investments
532757,Voltamp Transformers Ltd,voltamptransformers.com,532757,VOLTAMP,Electric Equipment,Capital Goods - Electrical Equipment,Voltamp Transformers is engaged in the Business of Manufacturing of Electrical Transformers.
523840,Innovative Tech Pack Ltd,itplgroup.com,523840,,Plastics Products,Plastic products,"Innovative Tech Pack is engaged in the business of manufacturing and reselling of plastic bottles, jars, and preforms and its caps."
NSE - SM : NANDANI,Nandani Creation Ltd,Company website,NSE - SM : NANDANI,,Textiles - Products,Textiles,"Nandani Creation Ltd. manufactures (and e-retails) of women apparels such as kurtis, kurtas, sarees, ethic tops, palazzo, patiala salwar suits, dupattas, quilted jackets, dress material, etc."
511754,Shalibhadra Finance Ltd,Company website,511754,,Finance & Investments,Finance,"Shalibhadra Finance Ltd. is engaged in finance and investment activities. The Company is an asset finance company focusing on rural, semi-urban and other under banked geographies of the states of Gujarat and Maharashtra."
520051,Jamna Auto Industries Ltd,jaispring.com,520051,JAMNAAUTO,Auto Ancillaries,Auto Ancillaries,"Jamna Auto Industries is engaged in the business of manufacturing and selling of Tapered Leaf, Parabolic Springs and Lift Axles."
530343,Genus Power Infrastructures Ltd,genus.in,530343,GENUSPOWER,Electronics - Components,Consumer Durables,"Genus Power Infrastructures is engaged in the business of manufacturing / providing Metering and Metering Solutions and undertaking Engineering, Construction and Contracts' on turnkey basis (core business division)."
532509,Suprajit Engineering Ltd,suprajit.com,532509,SUPRAJIT,Auto Ancillaries,Auto Ancillaries,"Suprajit Engineering is engaged in the Business of Automotive Cables, Automotive Lamps and Speedo meters."
530627,Vipul Organics Ltd,vipuldyes.com ; www.vipulorganics.com,530627,,Dyes And Pigments,Chemicals,"Vipul Organics is principally engaged in manufacturing & trading of Dyes stuff, Organic Pigments & Organic Intermediates."
541053,East India Securities Ltd,eisec.com,541053,,Finance & Investments,Finance,Finance >> Finance & Investments
523323,Kovai Medical Center & Hospital Ltd,kmchhospitals.com,523323,,Healthcare,Healthcare,Kovai Medical Center & Hospital is engaged in the business of Healthcare Sector.(Source : 201903 Annual Report Page No:93)
522122,Voith Paper Fabrics India Ltd,voithpaperfabricsindia.com,522122,,Textiles - Products,Textiles,"Voith Paper Fabrics India is primarily involved in the business of manufacturing and selling of paper machine clothing for pulp, paper and board industry."
500243,Kirloskar Industries Ltd,kil.net.in,500243,KIRLOSIND,Finance & Investments,Finance,Kirloskar Industries is engaged in wind-power generation and manufacturing of iron castings.(Source : 201903 Annual Report Page No: 162)
539148,Shivalik Rasayan Ltd,shivalikrasayan.com,539148,,Pesticides / Agrochemicals - Indian,Agro Chemicals,Shivalik Rasayan Limited is engaged in providing agrochemicals.
539658,Team Lease Services Ltd,teamlease.com,539658,TEAMLEASE,Miscellaneous,Miscellaneous,"Team Lease Services is engaged in the business of technical, legal, financial and management consultants, advisers, innovators, software, designer, marketers, fund managers, administrators, agents, recruitment and placement consultancy service providers, impart training in various fields, areas and subjects including but not limited to vocational training through any form viz."
530019,Jubilant Life Sciences Ltd,jubl.com,530019,JUBILANT,Pharmaceuticals - Indian - Bulk Drugs,Pharmaceuticals,"Jubilant Life Sciences is an integrated global pharmaceutical and life sciences company engaged in pharmaceuticals, life science ingredients and drug discovery and development solutions. The pharmaceuticals segment, through its wholly owned subsidiary Jubilant Pharma Limited, is engaged in manufacture and supply of APIs, solid dosage formulations, radiopharmaceuticals, allergy therapy products and contract manufacturing of sterile injectables and non-sterile products through 6 USFDA approved manufacturing facilities in India, USA and Canada and a network of over 50 radiopharmacies in the US."
541167,Yasho Industries Ltd,yashoindustries.com,541167,,Chemicals,Chemicals,"Yasho Industries is engaged in the Business of Chemicals and has two factories situated in GIDC, Vapi, Gujarat."
519105,AVT Natural Products Ltd,avtnatural.com,519105,AVTNPL,Solvent Extraction,Edible Oil,"AVT Natural Products is engaged in the production, trading and distribution of Oleoresins and value added Teas.(Source : 201903 Annual Report Page No: 61)"
NSE - SM : IRISDOREME,Iris Clothings Ltd,Company website,NSE - SM : IRISDOREME,,Textiles - Products,Textiles,Textiles >> Textiles - Products
501423,Shaily Engineering Plastics Ltd,shaily.com,501423,,Plastics Products,Plastic products,"Shaily Engineering Plastics is engaged in the manufacture and sale of injection moulded precision plastic components, sub-assemblies and other related services."
505750,Jost's Engineering Company Ltd,josts.com,505750,,Engineering,Capital Goods-Non Electrical Equipment,Josts Engineering Company is primary engaged in the business areas are material handling and engineered products.
543066,SBI Cards & Payment Services Ltd,sbicard.com,543066,SBICARD,Finance & Investments,Finance,Finance >> Finance & Investments
524075,Albert David Ltd,albertdavidindia.com,524075,ALBERTDAVD,Pharmaceuticals - Indian - Formulations,Pharmaceuticals,"Albert David is engaged in manufacturing and trading of Pharmaceutical Formulations, Infusion Solutions, Herbal Dosage Forms and Bulk Drugs by way of domestic sale or export.(Source : 201903 Annual Report Page No: 99)"
510245,Swasti Vinayaka Synthetics Ltd,swastivinayaka.com,510245,,Trading,Trading,"Swasti Vinayaka Synthetics is engaged interalia, in the business of manufacturing of wide range of shirting fabrics comprising of cotton, linen, lycra, polyester, viscose and their blends."
538817,Captain Pipes Ltd,captainpipes.com,538817,,Plastics Products,Plastic products,Captain Pipes is engaged in th business of manufacturing and selling of UPVC pipes and fittings.
530199,Themis Medicare Ltd,themismedicare.com,530199,THEMISMED,Pharmaceuticals - Indian - Bulk Drugs & Formln,Pharmaceuticals,"Themis Medicare is principally engaged in the activities pertaining to manufacturing of pharmaceutical products, especially in Formulation and API activity."
531146,Medicamen Biotech Ltd,medicamen.com,531146,,Pharmaceuticals - Indian - Formulations,Pharmaceuticals,Medicamen Biotech Limited is engaged in manufacturing of pharmaceutical formulations.
509496,ITD Cementation India Ltd,itdcem.co.in,509496,ITDCEM,Construction,Construction,"ITD Cementation India is engaged in the business of construction of a wide variety of structures like maritime structures, Mass Rapid Transport Systems (MRTS), dams & tunnels, airports, highways, bridges & flyovers and other foundations and specialised engineering work."
539527,Creative Castings Ltd,creative-cast.com,539527,,Castings & Forgings,"Castings, Forgings & Fastners",Creative Castings is engaged in manufacturing and selling of all types of Steel and Alloy Steel Investment Castings . The company is also engaged in generating of power from wind energy.
539289,Majesco Ltd,majesco.com,539289,MAJESCO,Computers - Software - Medium / Small,IT - Software,"Majesco is engaged in a provider of core platforms and technology solutions in Insurance (Life, Pensions and General).(Source : 201903 Annual Report Page No: 87)"
542141,Techno Electric & Engineering Company Ltd,techno.co.in,542141,TECHNOE,Engineering - Turnkey Services,Infrastructure Developers & Operators,Techno Electric & Engg. Company is also engaged in generation of wind power through Wind Turbine Generators.
500333,Pix Transmission Ltd,pixtrans.com,500333,,Miscellaneous,Plantation & Plantation Products,PIX Transmissions is the leading manufacturer of Belts and related mechanical Power Transmission products in India. The Company features state-of-the-art Belt manufacturing units as well as a completely automated Rubber Mixing facility in Nagpur.
504966,Tinplate Company of India Ltd,tatatinplate.com,504966,TINPLATE,Mining / Minerals / Metals,Non Ferrous Metals,Tinplate Company of India is engaged in business of Tinplate Manufacturing.
540749,MAS Financial Services Ltd,mas.co.in,540749,MASFIN,Finance & Investments,Finance,"MAS has been engaged in specialised retail financing services for over two decades. Catering to the financial needs of lower income and middle-income groups of society, MAS offers a range of retail financing products for Micro Enterprises and Small and Medium Enterprises, Home Loans, Two-Wheeler Loans, Used Car Loans and Commercial Vehicle Loans.(Source : 201903 Annual Report Page No: 06)"
531508,Eveready Industries India Ltd,evereadyindustries.com; www.evereadyindia.com,531508,EVEREADY,Dry Cells,Dry cells,"Eveready Industries India is engaged in the business of marketing of dry cell batteries, rechargeable batteries, flashlights, packet tea, general lighting products, small home appliances and confectioneries which come under a single business segment known as Consumer Goods."
531888,Rexnord Electronics & Controls Ltd,rexnordindia.com,531888,,Electric Equipment,Capital Goods - Electrical Equipment,Rexnord Electronics & Controls is engaged in the business of Manufacturing and sale of instrument cooling Fans and shaded pole motors used for industrial purpose.
500420,Torrent Pharmaceuticals Ltd,torrentpharma.com,500420,TORNTPHARM,Pharmaceuticals - Indian - Bulk Drugs & Formln,Pharmaceuticals,"Torrent Pharmaceuticals is one of the leading Indian Pharmaceutical Company engaged in research, development, manufacturing and marketing of generic pharmaceutical formulations."
523398,Johnson Controls-Hitachi Air Condition. India Ltd,jci-hitachi.in,523398,JCHAC,Air-conditioners,Consumer Durables,Johnson Contls.-HitachiAirCondtg.Ind.is engaged in the business of Sales and Service of Air Conditioners.
531600,Gogia Capital Services Ltd,gogiacap.com,531600,,Finance & Investments,Finance,Gogia Capital Services Ltd. Is providing Stock and Commodity Broking Services to Corporates and Individuals.
513108,Gandhi Special Tubes Ltd,gandhitubes.com,513108,GANDHITUBE,Steel - Medium / Small,Steel,"Gandhi Special Tubes is engaged in the business of manufacture of Seamless and Welded Steel Tubes, Nuts and generation of Wind Power."
540268,Dhanvarsha Finvest Ltd,dhanvarshafinvest.com,540268,,Finance & Investments,Finance,"Dhanvarsha Finvest Limited provides financing services. The Company offers home, personal, property, educational, term, and business loans, as well as insurance and finance brokerage services."
532796,Lumax Auto Technologies Ltd,lumaxautotech.com,532796,LUMAXTECH,Auto Ancillaries,Auto Ancillaries,"Lumax Auto Technologies is engaged in the business of Automotive Lamps, Plastic Moulded Parts and Frame Chassis. (Source : 202003 Annual Report Page No:101)"
519455,Narbada Gems & Jewellery Ltd,narbadajewellery.com,519455,,Diamond Cutting / Jewellery,"Diamond, Gems and Jewellery",Narbada Gems & Jewellery is in the business of dealing and trading in flat diamond studded and colored precious stone studded jewellery.
505827,SNL Bearings Ltd,snlbearings.in,505827,,Bearings,Auto Ancillaries,SNL Bearings is engaged in the business of manufacture and marketing of antifriction bearing products.
539528,Aayush Food And Herbs Ltd,aayushfoods.com,539528,,Pharmaceuticals - Indian - Formulations,Pharmaceuticals,Aayush Food & Herbs is engaged primarily in the Business of trading of rice in different varieties.
NSE - SM : AMBANIORG,Ambani Organics Ltd,Company website,NSE - SM : AMBANIORG,,Chemicals,Chemicals,"Ambani Organics Ltd. is a chemical manufacturing company with manufacturing and Processor, Importer, Supplier and Exporter of Chemical & Dyes used in Painting and Textile Industry."
532842,Sree Rayalaseema Hi-Strength Hypo Ltd,tgvgroup.com,532842,SRHHYPOLTD,Chemicals,Chemicals,Sree Rayalaseema Hi-Strength Hypo Limited is an India-based manufacture of inorganic chemicals. The Company is engaged in manufacturing and sale of industrial chemicals and generation and distribution of power.
517536,Onward Technologies Ltd,onwardgroup.com,517536,ONWARDTEC,Computers - Software - Medium / Small,IT - Software,"Onward Technologies is a leading global player in Mechanical Engineering Design and IT consulting, and the holding company."
534691,Comfort Commotrade Ltd,comfortcommotrade.com,534691,,Finance & Investments,Finance,"Comfort Commotrade Limited is engaged in the business of commodity broking. The Company is involved in the business of trading in various commodities, such as bullion (gold, silver), energy (crude oil, natural gas), metals, food grains (rice, maize), spices, oil and oil seeds and others."
540405,Oceanic Foods Ltd,oceanicfoods.com,540405,,Food - Processing - Indian,FMCG,Oceanic Foods Limited is an India-based manufacturer and exporter of dehydrated spices and vegetables. The Company manufactures dehydrated products from raw vegetables and semi-finished dehydrated vegetables.
532163,Saregama India Ltd,saregama.com,532163,SAREGAMA,Entertainment / Electronic Media Software,Entertainment,"Saregama India is engaged in engaged in the business of manufacturing and sale of Music storage device viz. Carvaan, Music Card, Audio Compact Discs, Digital Versatile Discs and dealing with related music rights."
532456,Compuage Infocom Ltd,compuageindia.com,532456,COMPINFO,Computers - Hardware,IT - Hardware,"Compuage Infocom is engaged in the Business of trading in Computer parts and peripherals, Software and Telecom Products."
532395,AXISCADES Engineering Technologies Ltd,axiscades.com,532395,AXISCADES,Computers - Software - Medium / Small,IT - Software,AXISCADES Engineering Technologies operates in the business of Engineering Design Services.
503722,Banswara Syntex Ltd,banswarasyntex.com,503722,BANSWRAS,Textiles - Spinning - Synthetic / Blended,Textiles,"Banswara Syntex is a vertically integrated textile mill manufacturing man-made synthetic blended Yarn, wool and wool mixed yarn, all type of Fabrics, Jacquard Furnishing Fabrics, besides production of Readymade Garments and Made-ups."
505283,Kirloskar Pneumatic Company Ltd,kirloskarkpcl.com,505283,,Compressors / Drilling Equipment,Capital Goods-Non Electrical Equipment,"Kirloskar Pneumatic Company is engaged in the business of Compression & Transmission segments, primarily serving sectors of oil & gas, engineering, steel, cement, food & beverage by offering engineered products and solutions. The Compression segment is engaged in design, manufacture, supply, and erection / commissioning of wide range of air, gas and refrigeration compressors, packages & systems. The Transmission segment is engaged in design, manufacture and supply of railway traction gears and customized gearboxes for windmill, industrial and marine applications. The Company has also started RoadRailer operations providing logistic services using rail network of Indian Railways with first and last mile operations carried on road."
533320,Jubilant Industries Ltd,jubilantindustries.com,533320,JUBLINDS,Breweries & Distilleries,Alcoholic Beverages,"Jubilant Industries Ltd. is the flagship Company of Agri and Performance Polymers business of the Jubilant Bhartia group. The Company s diversified portfolio includes a wide range of Crop Nutrition, Crop Growth and Crop protection Agri products and Performance Polymers products comprising consumer products like adhesives, wood finishes; food polymers and latex such as Vinyl Pyridine, SBR and NBR latex."
516016,Shreyans Industries Ltd,shreyansgroup.com,516016,SHREYANIND,Paper,Paper,Shreyans Industries is engaged in the manufacturing of Writing and Printing Paper. The Company caters to both domestic and international market.(Source : 201903 Annual Report Page No: 44)
521016,Indo Count Industries Ltd,indocount.com,521016,ICIL,Textiles - Cotton/Blended,Textiles,"Indo Count Industries is engaged in the Business of Manufacture of bedding, quilts pillows, sleeping bags and Preparation and spinning of cotton fiber including blended cotton."
505850,Mangal Credit & Fincorp Ltd,mangalfincorp.com,505850,,Finance & Investments,Finance,"Mangal Credit And Fincorp Ltd. is engaged in providing financial services and investments. The company offers loans and credit facilities, private educational funding, trade in money market underwriting stocks, and fundings."
539122,Bodhtree Consulting Ltd,bodhtree.com,539122,,Computers - Software - Medium / Small,IT - Software,Bodhtree Consulting is an IT and IT Enabling Services (ITES) provider. The company is headquartered in India and provides technology consulting services to various companies and SMEs across the globe.
503162,Reliance Chemotex Industries Ltd,reliancechemotex.com,503162,,Textiles - Spinning - Synthetic / Blended,Textiles,Reliance Chemotex Industries is engaged in the manufacturing and sale of Synthetic & blended Yarn.
511766,Muthoot Capital Services Ltd,muthootcap.com,511766,MUTHOOTCAP,Finance & Investments,Finance,"Muthoot Capital Services is a Systemically Important Deposit Accepting Non-Banking Financial Company (NBFC) primarily engaged in the business of financing for purchase of automobiles, mainly two wheelers against hypothecation of the vehicles and granting of personal/business loans etc.(Source : 201903 Annual Report Page No: 106)"
541403,Dollar Industries Ltd,dollarglobal.in,541403,DOLLAR,Textiles - Products,Textiles,"Dollar Industries is primarily engaged in manufacture and sale of hosiery products in knitted inner wears, casual wears and thermal wears."
519477,CIAN Agro Industries & Infrastructure Ltd,cianindustries.com,519477,,Solvent Extraction,Edible Oil,CIAN Agro Industries & Infrastr. Ltd is engaged in the business of cattle feeds and infrastructure. The Company is engaged in marketing of edible oils in domestic market and deoiled cakes in domestic and international markets.
532548,Century Plyboards (India) Ltd,centuryply.com,532548,CENTURYPLY,Miscellaneous,Miscellaneous,"Century Plyboards (India) is primarily engaged in manufacturing and sale of Plywood, Laminates, Decorative Veneers, Medium Density Fiber Boards (MDF), Pre-laminated Boards, Particle Board and Flush Doors and providing Container Freight Station (CFS) services."
532240,India Nippon Electricals Ltd,indianippon.com,532240,INDNIPPON,Auto Ancillaries,Auto Ancillaries,"India Nippon Electricals is a leading manufacturer of Ignition Systems for auto industry with special focus on twowheeler industry in technical collaboration with Mahle Electric Drives Japan Corporation, Japan."
540047,Dilip Buildcon Ltd,dilipbuildcon.com,540047,DBL,Construction,Infrastructure Developers & Operators,Dilip Buildcon is engaged in the business of development of infrastructure facilities on Engineering Procurement and Construction basis (EPC) and undertakes contract from various Government and other parties and special purpose vehicles promoted by the Company.
543217,Mindspace Business Parks REIT,Company website,543217,NSE - RR : MINDSPACE,Construction,Real Estate Investment Trusts,Real Estate Investment Trusts >> Construction
514165,Indian Acrylics Ltd,indianacrylics.com,514165,,Textiles - Manmade,Textiles,Indian Acrylics is engaged in Manufacture and Sale/ Trading of Acrylic Fibre/ Yarn and related activities.
533704,Essar Shipping Ltd,essar.com,533704,ESSARSHPNG,Shipping,Shipping,"Essar Shipping Limited is an integrated logistics services provider engaged into the businesses of sea transportation, logistics services and oilfields services."
508807,IST Ltd,istindia.com,508807,,Auto Ancillaries,Auto Ancillaries,"IST Limited is an India based company. The Company's products include automotive transmission parts, carburetor parts for two wheeler, fuel injection part for four wheeler."
541865,Add-Shop E-Retail Ltd,addshop.co,541865,,Trading,Trading,Trading >> Trading
532092,Sagar Productions Ltd,sagarproductions.com,532092,,Entertainment / Electronic Media Software,Entertainment,Sagar Productions Ltd. engages in media production and media trading activities in India.
532349,Transport Corporation of India Ltd,tcil.com,532349,TCI,Miscellaneous,Logistics,"Transport Corporation of India is engaged in the Business of Freight Transport,Supply Chain Solutions and Transport through Seaways."
