company_id,name,link,bse,nse,industry,sector,about
500097,Dalmia Bharat Sugar & Industries Ltd,dalmiasugar.com,500097,DALMIASUG,Sugar,Sugar,"Dalmia Bharat Sugar & Industries is mainly engaged in manufacturing of sugar, generation of power, manufacturing of Industrial alcohol and manufacturing of refractory products.(Source : 201903 Annual Report Page No: 88)"
NSE - SM : KKVAPOW,KKV Agro Powers Ltd,Company website,NSE - SM : KKVAPOW,,Power Generation And Supply,Power Generation & Distribution,KKV Agro Powers is an independent power producer (IPP) and renewable power generation company.
company_id,name,link,bse,nse,industry,sector,about
NSE - SM : MOKSH,Moksh Ornaments Ltd,Company website,NSE - SM : MOKSH,,Diamond Cutting / Jewellery,"Diamond, Gems and Jewellery","Moksh Ornaments is engaged in the business of manufacture and wholesale of jewellery and head quartered at Mumbai, Maharashtra.(Source : 201903 Annual Report Page No: 32)"
531952,Riba Textiles Ltd,ribatextiles.com,531952,,Textiles - Products,Textiles,"Riba Textiles is an export oriented Terry Towels and Tufted Rugs manufacturing unit based 100 kms from New Delhi in the state of Haryana, India."
512485,Dhanlaxmi Cotex Ltd,dcl.net.in,512485,,Finance & Investments,Finance,"Dhanlaxmi Cotex Ltd. produces grey poplin, cotton poplin, and suiting's. The company also trades yarn and fents."
532605,JBM Auto Ltd,jbm-group.com,532605,JBMA,Auto Ancillaries,Auto Ancillaries,JBM Auto is engaged in the automotive business that manufactures and sell sheet metal components tools dies & moulds and buses including sale of spare parts accessories & maintenance contract of Buses.
532800,TV18 Broadcast Ltd,network18online.com,532800,TV18BRDCST,Entertainment / Electronic Media Software,Entertainment,"TV18 Broadcast is engaged in the Business of spanning across Broadcasting, Digital Content and Allied Businesses."
540550,Yug Decor Ltd,yugdecor.com,540550,,Paints / Varnishes,Paints/Varnish,"Yug Decor is engaged in manufacturing and trading of various types of Adhesives/ Glues such as Water based adhesives, various types of Paints and Wood Finishes and its related packing materials."
532528,Datamatics Global Services Ltd,datamatics.com,532528,DATAMATICS,Computers - Software - Medium / Small,IT - Software,"Datamatics Global Services Ltd is a global provider of Information Technology (IT), Business Process Management (BPM) and Consulting services. The Company provides business aligned next-generation solutions to a wide range of industry verticals that help enterprises across the world overcome their business challenges and achieve operational efficiencies."
500083,Century Extrusions Ltd,centuryextrusions.com,500083,CENTEXT,Aluminium and Aluminium Products,Non Ferrous Metals,Century Extrusions is engaged in the business of Aluminium Extruded Products.
506414,Fermenta Biotech Ltd,dil.net,506414,,Pharmaceuticals - Indian - Bulk Drugs,Pharmaceuticals,"Established in 1951, DIL Limited (earlier known as Duphar-Interfran Limited) is a publicly-listed company that has developed a unique standing in the businesses of pharmaceuticals, biotechnology, environmental solutions and other segments.(Source : 201983 Annual Report Page No: 6)"
507753,TGV Sraac Ltd,tgvgroup.com,507753,,Chlor Alkali / Soda Ash,Chemicals,TGV Sraac is engaged in the leading producer of Chlor-Alkali products and also manufactures Castor Derivatives and Fatty Acids.
533303,BF Investment Ltd,kalyanigroup.com,533303,BFINVEST,Finance & Investments,Finance,BF Investment is primarily engaged in the business of making investments in group companies.
513519,Pitti Engineering Ltd,pitti.in,513519,PITTIENG,Engineering,Capital Goods-Non Electrical Equipment,"Pitti Engg. is engaged in the manufacturing of Electrical Steel Laminations, Motor Cores, Sub-Assemblies, Die-Cast Rotors, Press Tools and machining of metal components."
530549,Shilpa Medicare Ltd,vbshilpa.com,530549,SHILPAMED,Pharmaceuticals - Indian - Bulk Drugs,Pharmaceuticals,"Shilpa Medicare is engaged in the business of manufacturing of API, Formulation and Development service."
538715,Dhabriya Polywood Ltd,polywood.org,538715,,Plastics Products,Plastic products,"Dhabriya Polywood Limited is an India-based manufacturer and supplier of extruded poly vinyl chloride (PVC) profile sections for various indoor furniture applications, such as doors, partitions, ceiling and paneling, and un-plasticized polyvinyl chloride (uPVC) windows/door systems."
532553,Welspun Enterprises Ltd,welspunenterprises.com,532553,WELENT,Construction,Construction,"Welspun Enterprises is engaged in infrastructure development (Engineering, Procurement and Construction (EPC) and Build, Operate and Transfer (BOT) basis). It is also engaged in carrying out Operation and Maintenance (O&M) activities for the transportation sector projects.(Source : 202003 Annual Report Page No: 125)"
524470,Syncom Formulations (India) Ltd,syncomformulations.com,524470,,Pharmaceuticals - Indian - Formulations,Pharmaceuticals,"Syncom Formulations (India) is engaged in manufactures and markets more than 200 pharmaceutical formulations products in various dosage forms like Tablets, Capsules, Liquids Orals, Liquid Vials and Ampoule Injections & Dry Vial injections, Dry Syrups, Ointments, Inhalers and Herbals."
532538,UltraTech Cement Ltd,ultratechcement.com; www.adityabirla.com,532538,ULTRACEMCO,Cement - North India,Cement,UltraTech Cement is engaged in engaged in the business of Manufacture of cement.
NSE - SM : JETKNIT,Jet Knitwears Ltd,Company website,NSE - SM : JETKNIT,,Textiles - Products,Textiles,"Jet Knitwears Limited is engaged in the business of manufacturing of intimate garments for men, women and children."
500241,Kirloskar Brothers Ltd,kirloskarpumps.com,500241,KIRLOSBROS,Pumps,Capital Goods-Non Electrical Equipment,"Kirloskar Brothers is engaged in providing global fluid management solutions. The core products of the Group are Engineered Pumps, Industrial Pumps, Agriculture and Domestic Pumps, Valves, and Hydro turbines.(Source : 201903 Annual Report Page No: 212)"
514316,Raghuvir Synthetics Ltd,raghuvir.com,514316,,Textiles - Processing,Textiles,Raghuvir Synthetics is engaged in Manufacturing of Textile items and Processing of the same. The business of the Company is to offer Exports of Made-ups and Processing of fabrics.
532848,Delta Corp Ltd,deltacorp.in,532848,DELTACORP,Miscellaneous,Entertainment,Delta Corp is engaged in the Business of Gambling and betting activities (Operation of casino).
NSE - SM : OSWALSEEDS,Shreeoswal Seeds & Chemicals Ltd,Company website,NSE - SM : OSWALSEEDS,,Miscellaneous,Miscellaneous,"Shreeoswal Seeds & Chemicals is engaged in the business of Preparation of crops for primary markets, cleaning, trimming, grading, disinfecting."
517544,Centum Electronics Ltd,centumelectronics.com,517544,CENTUM,Electronics - Components,Electronics,"Centum Electronics is engaged in the business of designs, manufactures and also exports electronic products. It also provides design services to its customers."
512529,Sequent Scientific Ltd,sequent.in,512529,SEQUENT,Pharmaceuticals - Indian - Bulk Drugs,Pharmaceuticals,Sequent Scientific is mainly engaged in the business of pharmaceuticals.
522034,Shanthi Gears Ltd,shanthigears.com,522034,SHANTIGEAR,Auto Ancillaries,Auto Ancillaries,"Shanthi Gears in the business of Gears, Gear Boxes and Geared Motors."
538646,Qgo Finance Ltd,parnamicredits.in,538646,,Finance & Investments,Finance,QGO Finance is engaged in the business of Financial Services.
539196,Amba Enterprises Ltd,ambaltd.com,539196,,Electric Equipment,Capital Goods - Electrical Equipment,"Amba Enterprises is an India-based power engineering solutions company. The Company is engaged in the manufacturing of transformers cores and lamination, and stamping for rotating machines."
NSE : AGROPHOS,Agro Phos India Ltd,Company website,NSE : AGROPHOS,,Fertilizers,Fertilizers,"Agro Phos (India) is an ISO 9001:2008 certified Company engaged in the manufacturing of fertilisers such as Single Super Phosphate (SSP), Nitrogen Phosphate and Potassium (NPK), Zinc Sulphate, Organic manure and Calcium Sulphate commonly known as soil conditioner or gypsum."
500335,Birla Corporation Ltd,birlacorporation.com,500335,BIRLACORPN,Cement - North India,Cement,Birla Corporation is primarily engaged in the manufacturing of cement as its core business activity.
539978,Quess Corp Ltd,quesscorp.com,539978,QUESS,Diversified - Large,Diversified,"Quess Corp is engaged in the business of providing services in Workforce management, Operating asset management and Tech services."
532413,Cerebra Integrated Technologies Ltd,cerebracomputers.com,532413,CEREBRAINT,Computers - Hardware,IT - Hardware,"Cerebra Integrated Technologies Limited is an India-based services provider. The Company is engaged in wholesale of computers, computer peripheral equipment and software; manufacture of desktop computers, laptop computers, hand-held computers, mainframe computers and computer servers, and computer consultancy and computer facilities management activities."
500260,The Ramco Cements Ltd,ramcocements.in,500260,RAMCOCEM,Cement - South India,Cement,"The Ramco Cements is engaged in manufacture of Cement, Ready Mix Concrete, and Dry Mortal Products. The Company caters mainly to the domestic markets. The Company is also engaged in sale of surplus electricity generated from its windmills and thermal power plants after meeting its captive requirements."
NSE - SM : MGEL,Mangalam Global Enterprise Ltd,Company website,NSE - SM : MGEL,,Solvent Extraction,Edible Oil,"Mangalam Global Enterprise is engaged in the Business of Castor Oil, Castor DOC & Castor Seeds ."
500490,Bajaj Holdings & Investment Ltd,bhil.in,500490,BAJAJHLDNG,Finance & Investments,Finance,Bajaj Holdings & Investment in the business of Investment activity.
530433,Shiva Global Agro Industries Ltd,shivaagro.org,530433,,Fertilizers,Fertilizers,Shiva Global Agro Industries Limited is an agriculture company. The Company is engaged in the manufacture and trading of farm inputs.
539254,Adani Transmission Ltd,adanitransmission.com,539254,ADANITRANS,Power Generation And Supply,Power Generation & Distribution,"Adani Transmission and its subsidiaries (together referred to as the Group) are engaged in the business of generation, transmission and distribution of power through India. The Group develops, owns and operates transmission lines across the States of Gujarat, Rajasthan, Bihar, Jharkhand, Uttar Pradesh, Maharashtra, Haryana, Chhattisgarh and Madhya Pradesh. Apart from the above the group also deals in various agro commodities."
500164,Godrej Industries Ltd,godrejinds.com,500164,GODREJIND,Chemicals,Chemicals,"Godrej Industries is engaged in the Business of Chemicals, Agri Inputs, Estate and Property Development, Vegetable Oil, Finance and Investments, Dairy, Animal Feeds, and other related activities."
NSE : STEELCITY,Steel City Securities Ltd,Company website,NSE : STEELCITY,,Finance & Investments,Stock/ Commodity Brokers,ABOUT
532774,Inspirisys Solutions Ltd,inspirisys.com,532774,INSPIRISYS,Computers - Software - Medium / Small,IT - Software,"Inspirisys Solutions is engaged in the Business of Systems Integration , IT Services and Warranty Management Services."
532656,Facor Alloys Ltd,facorgroup.in,532656,,Mining / Minerals / Metals,Mining & Mineral products,Facor Alloys Limited is an India-based holding company. The Company is engaged in the manufacture and sale of Ferro alloys and Ferro chrome.
532834,Camlin Fine Sciences Ltd,camlinfs.com,532834,CAMLINFINE,Chemicals,Chemicals,Camlin Fine Sciences is engaged in the Business of Speciality Chemicals.
532900,Paisalo Digital Ltd,seil.in,532900,PAISALO,Finance & Investments,Finance,Paisalo Digital is engaged in a systemically important non deposit taking non-banking finance company providing loans.(Source : 201903 Annual Report Page No: 108)
540108,Tiaan Ayurvedic & Herbs Ltd,tiaanonline.com,540108,,Trading,Trading,"Tiaan Ayurvedic & Herbs distributes ayurvedic and herbs products in India. It offers personal care products, such as ayurvedic soaps, creams, scrubs, facial care products, and shampoos; and health and nutrition products."
NSE : HITECH,Hi-Tech Pipes Ltd,Company website,NSE : HITECH,,Steel - Medium / Small,Steel,"Hi-Tech Pipes is engaged in the business of manufacturing of ERW Steel Round & Section Pipes, cold Rolled Strips & Engineering products and distribution of the same across India"
541153,Bandhan Bank Ltd,bandhanbank.com,541153,BANDHANBNK,Banks - Private Sector,Banks,Bandhan Bank is engaged in the Business of Banking and Financial Services.
526355,Duropack Ltd,duropackindia.com,526355,,Packaging,Packaging,"Duropack is engaged in Manufacture and export of multi layer laminate films, pouches and bags."
509675,Hil Ltd,hil.com,509675,HIL,Cement Products,Cement - Products,Hil in the business of FIber Cement Sheets and Fly Ash Bricks .
531161,ABM Knowledgeware Ltd,abmindia.com,531161,,Computers - Software - Medium / Small,IT - Software,"ABM Knowledgeware is engaged in the business of providing activities in egovernance, information security, technology enabled applications through cloud services and other software services.(Source : 201903 Annual Report Page No:39)"
539404,Satin Creditcare Network Ltd,satincreditcare.com,539404,SATIN,Finance & Investments,Finance,Satin Creditcare Network is engaged in the Business of providing micro finance services to women in the rural areas.
NSE - SM : RPPL,Rajshree Polypack Ltd,Company website,NSE - SM : RPPL,,Packaging,Packaging,Packaging >> Packaging
500034,Bajaj Finance Ltd,bajajfinserv.in/finance,500034,BAJFINANCE,Finance & Investments,Finance,Bajaj Finance is engaged in the Business of lending and acceptance of deposits.
505368,Revathi Equipment Ltd,reavthi.in,505368,REVATHI,Compressors / Drilling Equipment,Capital Goods-Non Electrical Equipment,Revathi Equipment is engaged in the business of Blast hole drilling and water well drilling equipments.
542641,Cox & Kings Financial Service Ltd,ckfsl.com,542641,NSE - BZ : CKFSL,Finance & Investments,Finance,"Cox & Kings Financial Services is engaged into carry on foreign exchange business, holiday financing, student loan financing and other non-banking financial service activities"
505232,Veljan Denison Ltd,veljan.in,505232,,Engineering,Capital Goods-Non Electrical Equipment,"Veljan Denison is engaged in the business of Manufacturing of Hydraulic Pumps, Motors, Valves and custom build Power Packs."
517449,Magna Eletrocasting Ltd,magnacast.com,517449,,Castings & Forgings,"Castings, Forgings & Fastners",Magna Eletrocasting is engaged in the manufacturing and selling of Cast Iron Components.(Source : 201903 Annual Report Page No: 82)
NSE : VERTOZ,Vertoz Advertising Ltd,Company website,NSE : VERTOZ,,Miscellaneous,Miscellaneous,ABOUT
533293,Kirloskar Oil Engines Ltd,koel.co.in,533293,KIRLOSENG,Engines,Capital Goods-Non Electrical Equipment,"Kirloskar Oil Engines is engaged in the business of manufacturing of engines, generating sets, pump sets and power tillers and spares thereof.(Source : 201903 Annual Report Page No: 126)"
513693,KIC Metaliks Ltd,kicmetaliks.com,513693,,Castings & Forgings,"Castings, Forgings & Fastners",KIC Metaliks Ltd. is primarily engaged in manufacturing and sale of Pig Iron.
502587,Nath Industries Ltd,ramapulp.com,502587,,Paper,Paper,Nath Industries the principal business is manufacturing of paper & chemicals.
504646,Bhagwati Autocast Ltd,bhagwati.com,504646,,Castings & Forgings,"Castings, Forgings & Fastners","Bhagwati Autocast is an ISO 9002 unit, having manufacturing capacity of 18000 MT p.a. of highly specialized Cast Iron(SI) & Spheroidal Graphite Iron (SGI) Castings. The wide range of castings is from 40 kg. to 140 kg. for the automobile and tractor OEM in the country."
514428,Hindustan Adhesives Ltd,bagla-group.com,514428,,Packaging,Packaging,Hindustan Adhesives is engaged in Business of Self Adhesive Tapes and Pof Film.
531595,Capri Global Capital Ltd,cgcl.co.in,531595,CGCL,Finance & Investments,Finance,Capri Global Capital is engaged in the Business of Financial Services except Insurance and pension funding activities.
530789,Ceejay Finance Ltd,ceejayfinancelimited.com,530789,,Finance & Investments,Finance,Ceejay Finance is engaged in a registered non-banking finance company under Reserve Bank of India regulations and is engaged in the loan finance business.(Source : 201903 Annual Report Page No: 06)
532539,Minda Industries Ltd,mindagroup.com,532539,MINDAIND,Auto Ancillaries,Auto Ancillaries,Minda Industries is engaged in the business of manufacturing of auto components including auto electrical parts and its accessories and caters to both domestic and international markets.(Source : 201903 Annual Report Page No: 124)
542649,Rail Vikas Nigam Ltd,rvnl.org,542649,RVNL,Construction,Construction,Rail Vikas Nigam is engaged in a create vital rail infrastructure and provide vital port linkage including the corridors connecting the port of Hinterlands.
540679,SMS Lifesciences India Ltd,smslife.in,540679,SMSLIFE,Pharmaceuticals - Indian - Bulk Drugs & Formln,Pharmaceuticals,Pharmaceuticals >> Pharmaceuticals - Indian - Bulk Drugs & Formln
532888,Asian Granito India Ltd,aglasiangranito.com,532888,ASIANTILES,Ceramics - Tiles / Sanitaryware,Ceramic Products,"Asian Granito India is engaged in the business of manufacturing of tiles. The Company offers tiles, such as wall and ceramics, and marble and quartz. The Company manufactures various types of vitrified tiles, including glazed and polished in over 1,200 designs."
515147,Haldyn Glass Ltd,haldynglass.com,515147,,Glass & Glass Products,Glass & Glass Products,"Haldyn Glass is engaged in the business of manufacturing of exclusive quality glass containers and bottles for Food, Beverages and Spirit Industries.(Source : 201903 Annual Report Page No:51)"
532321,Cadila Healthcare Ltd,zyduscadila.com,532321,CADILAHC,Pharmaceuticals - Indian - Bulk Drugs & Formln,Pharmaceuticals,"Cadila Healthcare is one of the leading, innovation driven pharmaceutical companies in India with presence across the pharmaceutical value chain of innovation (research & development), manufacturing, marketing and selling of finished dosage human formulations (generics, branded generics and specialty formulations, including biosimilars and vaccines), active pharmaceutical ingredients (APIs), animal healthcare products and consumer wellness products. Innovation is the backbone of the Company as it ensures business sustainability by ensuring the continuous supply of new products to various businesses.(Source : 201903 Annual Report Page No: 26)"
530079,Faze Three Ltd,fazethree.com,530079,,Textiles - Processing,Textiles,"Faze Three is engaged in manufacturing and exports of home furnishing items viz. bathmats, rugs, blankets, throws, cushions, etc."
539255,Star Delta Transformers Ltd,stardeltatransformers.com,539255,,Electric Equipment,Capital Goods - Electrical Equipment,ABOUT
539894,Madhav Infra Projects Ltd,madhavgrp.co.in,539894,,Construction,Construction,"Madhav Infra Projects Ltd. is focused on Energy, Highways, Urban Infrastructure and Real Estate industries."
530317,Godavari Drugs Ltd,godavaridrugs.com,530317,,Pharmaceuticals - Indian - Bulk Drugs,Pharmaceuticals,Godavari Drugs is engaged in the Business of manufacture of Active Pharmaceutical Ingredients.
500411,Thermax Ltd,thermaxindia.com,500411,THERMAX,Engineering,Capital Goods-Non Electrical Equipment,"Thermax is engaged in engaged in the business of boilers and heaters, absorption chillers/heat pumps, power plants, solar equipment, related services."
530979,India Home Loans Ltd,indiahomeloan.co.in,530979,,Finance - Housing,Finance,"India Home Loans is engaged in a housing finance company incorporated under the Companies Act, 1956 and registered with National Housing Bank (NHB) for carrying out the business of housing finance.(Source : 201903 Annual Report Page No: 69)"
526642,Mirza International Ltd,mirza.co.in,526642,MIRZAINT,Leather / Leather Products,Leather,"Mirza International is a leading manufacturer & exporter of finished leather,Footwear and trader of footwear and apparels."
523384,Maha Rashtra Apex Corporation Ltd,maharashtraapex.com,523384,NSE - BE : MAHAPEXLTD,Finance & Investments,Finance,"Maha Rashtra Apex Corporation is involved in the business of : Leasing, Hire Purchase and Bill Discounting."
533221,Asian Hotels (West) Ltd,asianhotelswest.com,533221,AHLWEST,Hotels,Hotels & Restaurants,Asian Hotels (West) Ltd is engaged in the Hotel.
500087,Cipla Ltd,cipla.com,500087,CIPLA,Pharmaceuticals - Indian - Bulk Drugs & Formln,Pharmaceuticals,Cipla is engaged in the Business of Pharmaceuticals.
NSE - SM : UCL,Ushanti Colour Chem Ltd,Company website,NSE - SM : UCL,,Dyes And Pigments,Chemicals,"Ushanti Colour Chem is engaged in Manufacture of dyes (includes manufacture of such dyes and colouring matters which are for final use by household/industrial/institutional consumers, manufacture of special dyes used in laboratories e.g. to colour microscopic preparations is also included)."
531810,Metal Coatings (India) Ltd,mcil.net,531810,,Steel - Medium / Small,Steel,"Metal Coatings (India) Limited is an India-based company, which operates in the steel sector."
532498,Shriram City Union Finance Ltd,shriramcity.in,532498,SHRIRAMCIT,Finance & Investments,Finance,"Shriram City Union Finance is primarily engaged in the business of financing small and medium enterprises, two-wheelers and pledged jewels. It also provides personal loans and auto loans. The Company is a Deposit Accepting Non- Banking Finance Company (NBFC) registered as a Loan Company with the Reserve Bank of India (RBI) and Ministry of Corporate Affairs."
502168,NCL Industries Ltd,nclind.com,502168,NCLIND,Cement - South India,Cement,NCL Industries is a leading manufacturer of cement under the brand name Nagarjuna Cement & Cement Bonded Particle Boards under the brand name Bison Panel.
531268,B2B Software Technologies Ltd,b2bsoftech.com,531268,,Computers - Software - Medium / Small,IT - Software,"B2B Software Technologies is one of the most prominent and competent Microsoft Dynamics Navision Solution Center of Microsoft Dynamics and the number one partner in Telangana, India."
500464,Ucal Fuel Systems Ltd,ucalfuel.com,500464,UCALFUEL,Auto Ancillaries,Auto Ancillaries,Ucal Fuel Systems is enaged in offers comprehensive fuel management systems for automotive sector.
524037,Rama Phosphates Ltd,ramaphosphates.com,524037,,Fertilizers,Fertilizers,"Rama Phosphates is engaged in fertilizer and Soya oil manufacturing, having manufacturing facility located at Indore."
533033,ISGEC Heavy Engineering Ltd,isgec.com,533033,,Engineering,Capital Goods-Non Electrical Equipment,"ISGEC Heavy Engineering is a Heavy Engineering Company having two segments i.e. manufacturing of machinery & equipment and engineering, procurement & construction. Manufacture of machinery & equipment comprise manufacture of process plant equipments etc.,(Source : 201903 Annual Report Page No: 71)"
500284,Lords Chloro Alkali Ltd,lordschloro.com,500284,,Chlor Alkali / Soda Ash,Chemicals,"Lords Chloro Alkali Limited is engaged in manufacturing of caustic soda, liquid chlorine, stable bleaching powder (SBP), hydrochloric acid, bleach liquor, trichloroethylene (TCE) and hydrogen gas."
500295,Vedanta Ltd,vedantalimited.com,500295,VEDL,Mining / Minerals / Metals,Mining & Mineral products,"Vedanta is engaged in the business of exploring, extracting and processing minerals and oil and gas. The Company engages in the exploration, production and sale of oil and gas, aluminium, copper, iron ore and power."
532420,Jullundur Motor Agency (Delhi) Ltd,jmaindia.com,532420,JMA,Auto Ancillaries,Auto Ancillaries,"Jullundur Motor Agency (Delhi) is engaged predominantly in trading and distribution of automobile parts, accessories and petroleum products primarily in India."
540144,DRA Consultants Ltd,dra.net.in; www.dineshrathi.com,540144,,Miscellaneous,Miscellaneous,"DRA Consultants is engaged in the business of providing consultancy services in energy saving, infrastructure development and water supply projects."
514215,Binny Ltd,binnyltd.in,514215,,Construction,Realty,Binny Ltd. is primarily engaged in the business of real estate development.
530169,Mohit Paper Mills Ltd,mohitpaper.in,530169,,Paper,Paper,"Mohit Paper Mills Limited is an India-based company, which is engaged in the manufacturing of writing and printing paper, and newsprint."
541770,CreditAccess Grameen Ltd,grameenkoota.org,541770,CREDITACC,Finance & Investments,Finance,CreditAccess Grameen is engaged in the Business of providing micro finance services to women who are enrolled as members and organized as Joint Liability Groups (JLG) or Self-Help Groups ('SHG').
541945,Ranjeet Mechatronics Ltd,ranjeet.co.in,541945,,Engineering - Turnkey Services,Capital Goods-Non Electrical Equipment,Capital Goods-Non Electrical Equipment >> Engineering - Turnkey Services
530589,Prima Plastics Ltd,primaplastics.com,530589,,Plastics Products,Plastic products,Prima Plastics is engaged in one of the leading plastic moulded article manufacturing company in India having 4 manufacturing facilities spread across the country.(Source : 201903 Annual Report Page No: 69)
539334,Shree Pushkar Chemicals & Fertilizers Ltd,shreepushkar.com,539334,SHREEPUSHK,Dyes And Pigments,Chemicals,"Shree Pushkar Chemicals & Fertilisers Ltd is engaged in the business of manufacturing and trading of chemicals, dyes and dyes intermediate, cattle feeds, fertilizers and soil conditioner."
517334,Motherson Sumi Systems Ltd,motherson.com,517334,MOTHERSUMI,Auto Ancillaries,Auto Ancillaries,Motherson Sumi Systems is engaged in the Business of Wiring harness and components Polymer products.
