company_id,name,link,bse,nse,industry,sector,about
500680,Pfizer Ltd,pfizerindia.com,500680,PFIZER,Pharmaceuticals - Multinational,Pharmaceuticals,"Pfizer is engaged in the business of manufacturing, marketing, trading and export of pharmaceutical products."
524717,Titan Biotech Ltd,titanbiotechltd.com,524717,,Pharmaceuticals - Indian - Bulk Drugs & Formln,Pharmaceuticals,"Titan Biotech is one of the leading manufacturer and exporter of the Biological products which are used in the field of Pharmaceuticals, Nutraceutical, Food & Beverages, Biotechnology & Fermentation, Cosmetic,Veterinary & Animal Feed etc."
532689,PVR Ltd,pvrcinemas.com,532689,PVR,Entertainment / Electronic Media Software,Entertainment,"PVR is engaged in the business of Movie exhibition, distribution & production and also earns revenue from in-house advertisement, sale of food & beverages, gaming and restaurant business.(Source : 201903 Annual Report Page No: 154)"
523754,Mahindra EPC Irrigation Ltd,epcmahindra.com,523754,MAHEPC,Plastics Products,Plastic products,Mahindra EPC Irrigation is engaged in the Business of Micro Irrigation Systems - Drip and Sprinklers.
532504,Navin Fluorine International Limited,nfil.in,532504,NAVINFLUOR,Chemicals,Chemicals,"Navin Fluorine International belongs to the Padmanabh Mafatlal Group, with a legacy of business operations since 1967, having one of the largest integrated fluorochemicals complex in India. The Company primarily focuses on fluorine chemistry - producing refrigeration gases, inorganic fluorides, specialty organofluorines and offers Contract Research and Manufacturing Services.(Source : 201903 Annual Report Page No: 109)"
540376,Avenue Supermarts Ltd,dmartindia.com,540376,DMART,Trading,Retail,Avenue Supermarts is engaged in the Business of Retail Trade.
534796,CDG Petchem Ltd,urbaknitt.com,534796,,Packaging,Packaging,"Urbaknitt Fabs (Formerly Known As Pankaj Polypack Limited) is engaged in the Business of Manufacture of Shade Nets, Safety Nets and Technical Fabrics."
531726,Panchsheel Organics Ltd,panchsheelorganics.com,531726,,Pharmaceuticals - Indian - Bulk Drugs,Pharmaceuticals,"Panchsheel Organics Ltd is an ISO 9001 : 2008 CERTIFIED, GMP approved public listed company are manufacturers and exporters of Active Pharma Ingredients, Intermediates & Finished Formulations having a wide experience of more than three decades in the healthcare field."
539997,Kwality Pharmaceuticals Ltd,kwalitypharma.com,539997,,Pharmaceuticals - Indian - Bulk Drugs,Pharmaceuticals,"Kwality Pharmaceuticals Limited is an India-based holding company. The Company manufactures and exports pharmaceutical formulations in liquid orals, dry syrups, tablets, capsules, sterile powder for injections, small volume injectables, ointments, external preparations and oral rehydration solution (ORS)."
530803,Bhageria Industries Ltd,bhageriagroup.com,530803,BHAGERIA,Dyes And Pigments,Chemicals,Bhageria Industries is engaged in manufacturing of Dyes & Dyes Intermediate and generation and distribution of solar power.
511654,Sugal & Damani Share Brokers Ltd,sugalshare.com,511654,,Finance & Investments,Finance,Sugal & Damani Share Brokers is engaged in the business of Share Broking.
505710,Grauer & Weil (India) Ltd,growel.com,505710,,Chemicals,Chemicals,"Grauer & Weil (India) is engaged in the business of manufacturing and selling of Surface Finishings, Phosphating plants, Electroplating plants, Waste Water Treatment plants and its components besides Shoppertainment business.(Source : 201903 Annual Report Page No:62)"
506076,Grindwell Norton Ltd,grindwellnorton.co.in,506076,GRINDWELL,Abrasives And Grinding Wheels,Capital Goods-Non Electrical Equipment,Grindwell Norton in the business of Abrasives and Refractory Products.
534804,CARE Ratings Ltd,careratings.com,534804,CARERATING,Miscellaneous,Credit Rating Agencies,CARE Ratings is a credit rating agency. The Company is engaged in providing financial services other than securities dealing activities.
539939,Yash Chemex Ltd,yashchemex.com,539939,,Trading,Trading,Yash Chemex is engaged in the business of Wholesale of industrial chemicals.
540777,HDFC Life Insurance Company Ltd,hdfclife.com,540777,HDFCLIFE,Finance & Investments,Insurance,"HDFC Life Insurance Company is a carrying on the business of life insurance. The Company offers a range of individual and group insurance solutions. The portfolio comprises of various insurance and investment products such as Protection, Pension, Savings,"
522287,Kalpataru Power Transmission Ltd,kalpatarupower.com,522287,KALPATPOWR,Transmisson Line Towers / Equipment,Capital Goods - Electrical Equipment,"Kalpataru Power Transmission is engaged in the Business of Manufacture of structural metal products, tanks, reservoirs and steam gener-ators,Construction of roads and railways,Construction of utility projects and Electricity Power Generation, Transmission and Distribution. (Source : 202003 Annual Report Page No:146)"
533758,APL Apollo Tubes Ltd,aplapollo.com,533758,APLAPOLLO,Steel - Large,Steel,APL Apollo Tubes is engaged in the business of production of ERW steel tubes.
532486,Pokarna Ltd,pokarna.com,532486,POKARNA,Miscellaneous,Miscellaneous,"Pokarna Limited is engaged in processing and sale of granite slabs, and mining and sale of granite blocks. The Company offers natural stones surfaces. The Company operates through two segments: Granite and Apparel."
513548,Sharda Ispat Ltd,shardaispat.com,513548,,Steel - Medium / Small,Steel,"Sharda Ispat Ltd is an India-based company. The Company is focused on manufacturing products such as Flats, Round Bars, and Square Bars (RCS0."
532155,GAIL (India) Ltd,gailonline.com,532155,GAIL,Miscellaneous,Gas Distribution,GAIL (India) is also engaged in the business of Oil and Gas Exploration and Production to increase the access to gas supplies through equity and joint venture participations.(Source : 201903 Annual Report Page No: 204)
523539,Precision Wires India Ltd,precisionwires.com,523539,PRECWIRE,Mining / Minerals / Metals,Non Ferrous Metals,"Precision Wires India is engaged in the business of manufacturing of Enamelled Round and Rectangular Copper Winding Wires, Continuously Transposed Conductor (CTC) and Paper / Mica / Nomex Insulated Copper Conductor (PICC) which are used by the electrical / electronics industries."
NSE : MCL,Madhav Copper Ltd,Company website,NSE : MCL,,Mining / Minerals / Metals,Mining & Mineral products,"Madhav Copper Limited is an India-based company, which is engaged in the manufacture and supply of enameled copper wire and poly wrap submersible winding wire."
532835,ICRA Ltd,icra.in,532835,ICRA,Miscellaneous,Credit Rating Agencies,"ICRA Ltd. is a leading financial/ investment institutions, commercial banks and financial services companies as an independent and professional Investment Information and Credit Rating Agency."
532859,Hinduja Global Solutions Ltd,teamhgs.com,532859,HGS,Computers - Software - Medium / Small,IT - Software,"Hinduja Global Solutions is engaged in Business Process Management. HGS with its subsidiaries offer voice and non-voice based services such as contact center solutions and back office transaction processing across America, Canada, Europe, Asia and Middle East."
540956,Bhatia Communications & Retail (India) Ltd,bhatiamobile.com,540956,,Trading,Trading,"Bhatia Communications & Retail is engaged in Business of retail and whole sell distribution business of mobile handsets, tablets, data-cards, mobile accessories, mobile related products.(Source : 201903 Annual Report Page No:26)"
504112,NELCO Ltd,nelco.in,504112,NELCO,Telecommunications - Equipment,Telecomm Equipment & Infra Services,NELCO is engaged in the Business of Network Systems and Automation & Control.
512626,Orbit Exports Ltd,orbitexports.com,512626,ORBTEXP,Textiles - Processing,Textiles,Orbit Exports is principally operates in two business segments: Manufacturing of Textile and Windmill Power Generation.
539725,Gokul Agro Resources Ltd,gokulagro.com,539725,GOKULAGRO,Solvent Extraction,Edible Oil,"Gokul Agro Resources is engaged in business of Manufacturing & Trading of Edible & Non-Edible Oil, Meals and other Agro Products."
507685,Wipro Ltd,wipro.com,507685,WIPRO,Computers - Software - Large,IT - Software,"Wipro is a global information technology (IT), consulting and business process services (BPS) company."
532725,Solar Industries India Ltd,solargroup.com,532725,SOLARINDS,Chemicals,Chemicals,"Solar Industries India is primarily involved in manufacturing of complete range of industrial explosives and explosive initiated devices. It manufactures various types of packaged emulsion explosives, bulk explosives and explosive initiating systems."
539518,Uday Jewellery Industries Ltd,udayjewellery.com,539518,,Diamond Cutting / Jewellery,"Diamond, Gems and Jewellery",Uday Jewellery Industries is engaged in Business of Jewellery Manufacturing Services.
530897,N G Industries Ltd,ngind.com,530897,,Healthcare,Healthcare,"NG Industries Ltd is engaged in medical services through its divisions popularly known as N G Medicare & Calcutta Hope Infertility Clinic, N G Nursing Home and N G Pharmacy."
590078,Maithan Alloys Ltd,maithanalloys.com,590078,MAITHANALL,Mining / Minerals / Metals,Mining & Mineral products,"Maithan Alloys is engaged in the business of manufacturing and exporting of all three bulk Ferro alloys- Ferro Manganese, Silico Manganese and Ferro Silicon. It is also engaged in the generation and supply of Wind Power and has a Captive Power Plant.(Source : 201903 Annual Report Page No: 88)"
500163,Godfrey Phillips India Ltd,godfreyphillips.com,500163,GODFRYPHLP,Cigarettes,Tobacco Products,"Godfrey Phillips India is engaged in manufacturing of cigarettes, tobacco products and chewing products and in trading of tobacco products, and other retail products."
532942,KNR Constructions Ltd,knrcl.com,532942,KNRCON,Construction,Construction,"KNR Constructions is engaged in the Business of Construction, Engineering and Infrastructure Development activities."
533146,D-Link India Ltd,dlink.co.in,533146,DLINKINDIA,Computers - Hardware,IT - Hardware,D-Link (India) is primarily engaged in the business of marketing and distribution of Networking products.
532732,Kewal Kiran Clothing Ltd,kewalkiran.com,532732,KKCL,Textiles - Products,Readymade Garments/ Apparells,"Kewal Kiran Clothing is engaged in the Business of Manufacturing of wearing apparels, except fur apparels."
514260,Surbhi Industries Ltd,surbhi.com,514260,,Textiles - Processing,Textiles,Surbhi Industries is engaged in Business of Preparation and spinning of textile fibre including weaving of textile.
502893,United Interactive Ltd,unitedinteractive.in,502893,,Computers - Software - Medium / Small,IT - Software,United Interactive is engaged in the business of IT & IT Enabled Services .
NSE : CDSL,Central Depository Services (India) Ltd,Company website,NSE : CDSL,,Miscellaneous,Miscellaneous,"Central Depository Services (India) Limited operates as a securities depository in India. The Company offers service for a range of clients, such as depositary participants and other capital market intermediaries, corporates, capital market intermediaries, insurance companies and others."
520073,RACL Geartech Ltd,raclgeartech.com,520073,,Auto Ancillaries,Auto Ancillaries,"RACL Geartech Limited, formerly Raunaq Automotive Components Limited, is an India-based company, which is engaged in automotive gears and components business."
500472,SKF India Ltd,skfindia.com,500472,SKFINDIA,Bearings,Bearings,SKF India is engaged in the business of Bearings and its component.
NSE - SM : MAHICKRA,Mahickra Chemicals Ltd,Company website,NSE - SM : MAHICKRA,,Dyes And Pigments,Chemicals,Chemicals >> Dyes And Pigments
NSE : DPABHUSHAN,D. P. Abhushan Ltd,Company website,NSE : DPABHUSHAN,,Diamond Cutting / Jewellery,"Diamond, Gems and Jewellery","Diamond, Gems and Jewellery >> Diamond Cutting / Jewellery"
500144,Finolex Cables Ltd,finolex.com,500144,FINCABLES,Cables - Power,Cables,"Finolex Cables is principally engaged in the manufacturing of Electricals Cables, Communication Cables & other electrical appliances."
539216,Garment Mantra Lifestyle Ltd,junctionfabrics.in,539216,,Textiles - Products,Textiles,"Junction Fabrics & Apparels is engaged in the business of manufacturing, selling and distribution of fabrics, hosiery garments and providing of related services.(Source : 201903 Annual Report Page No: 65)"
NSE : JASH,Jash Engineering Ltd,jashindia.com/,NSE : JASH,,Engineering,Capital Goods-Non Electrical Equipment,"Jash Engineering is engaged in the business of manufacturing and trading of varied engineering Products for general Engineering industry, Water and waste water industry and bulk solids handing Industry."
524494,Ipca Laboratories Ltd,ipca.com,524494,IPCALAB,Pharmaceuticals - Indian - Bulk Drugs & Formln,Pharmaceuticals,Ipca Laboratories is engaged in the manufacturing and marketing of pharmaceuticals.(Source : 201903 Annual Report Page No: 68)
532889,K P R Mill Ltd,kprmilllimited.com,532889,KPRMILL,Textiles - Products,Readymade Garments/ Apparells,"K.P.R. Mill is engaged in one of the largest vertically integrated apparel manufacturing Companies in India. The Company produces Yarn, Knitted Fabric, Readymade Garments and Wind power.(Source : 201903 Annual Report Page No: 59)"
532374,Sterlite Technologies Ltd,sterlitetechnologies.com,532374,STLTECH,Cables - Telephone,Cables,Sterlite Technologies is primarily engaged in the business of Connectivity and Network solutions.
533151,D B Corp Ltd,bhaskarnet.com; www.dainikbhaskargroup.com,533151,DBCORP,Entertainment / Electronic Media Software,Media - Print/Television/Radio,"D. B. Corp is Indias largest Newspaper Group, and a leading and diversified media player. We enjoy a dominant position across major markets, states and languages.(Source : 201903 Annual Report Page No: 04)"
523606,Sika Interplant Systems Ltd,sikaglobal.com,523606,,Engineering,Capital Goods-Non Electrical Equipment,Sika Interplant Systems is engaged in Business of Engineering Products for Aerospace & Defence.
539301,Arvind SmartSpaces Ltd,arvindsmartspaces.com,539301,ARVSMART,Construction,Realty,"Arvind SmartSpaces is engaged in the development of real estate comprising of residential, commercial and industrial projects.(Source : 201903 Annual Report Page No: 69)"
NSE : UNIVASTU,Univastu India Ltd,Company website,NSE : UNIVASTU,,Construction,Construction,"Univastu India is an ISO 9001:2015 certified construction company and we provide integrated engineering, procurement and construction services (EPC) for civil & Structural construction and infrastructure sector projects."
500245,Kirloskar Ferrous Industries Ltd,kfil.com,500245,KIRLFER,Steel - Pig Iron,Steel,Kirloskar Ferrous Industries is engaged in the Business of Iron Castings.
504058,Indo National Ltd,nippobatteries.com,504058,NIPPOBATRY,Dry Cells,Dry cells,"Indo National is engaged in the business of manufacture and marketing of batteries, torches, LED products, emergency power backup products, mosquito bats and other electrical goods."
500495,Escorts Ltd,escortsgroup.com,500495,ESCORTS,Automobiles - Tractors,Automobile,"Escorts is engaged in the business of manufacturing of agricultural tractors, engines for agricultural tractors, construction, earth moving and material handling equipment, round and flat tubes, heating elements, double acting hydraulic shock absorbers for railways coaches, centre buffer couplers, automobile shock absorbers, telescopic front fork & Mcpherson struts, brake block, internal combustion engines and all types of brake used by railways."
500410,ACC Ltd,acclimited.com,500410,ACC,Cement - North India,Cement,ACC Limited is engaged in manufacturing of cement and ready mixed concrete. The Company's segments include Cement and Ready Mix Concrete.
519457,Virat Crane Industries Ltd,cranegroup.in,519457,,Food - Processing - Indian,FMCG,Virat Crane Industries is engaged in the business of manufacturing of ghee.(Source : 201803 Annual Report Page No:16)
NSE : WORTH,Worth Peripherals Ltd,Company website,NSE : WORTH,,Paper,Paper,Paper >> Paper
523385,Nilkamal Ltd,nilkamal.com,523385,NILKAMAL,Plastics Products,Plastic products,"Nilkamal has eternally been a part of Indian homes interiors knowingly or unknowingly taking space in the form of may be a simple plastic chair in your living room or an entire furniture set in your bedrooms, making it Indias favourite furniture brand. (Source : Company Web-Site)"
NSE - SM : MPTODAY,Madhya Pradesh Today Media Ltd,Company website,NSE - SM : MPTODAY,,Entertainment / Electronic Media Software,Entertainment,Entertainment >> Entertainment / Electronic Media Software
NSE : SIRCA,Sirca Paints India Ltd,Company website,NSE : SIRCA,,Trading,Trading,Sirca Paints India is engaged in the business of all sole distribution
539018,Beekay Steel Industries Ltd,beekaysteel.com,539018,,Steel - Medium / Small,Steel,"Beekay Steel Industries is principally engaged in the business of manufacturing of Hot Rolled Steel Sections, Bright Bars, Structural Items and TMT Bars."
517522,Rajratan Global Wire Ltd,rgwl.co.in; www.rajratan.co.in,517522,RAJRATAN,Steel - Medium / Small,Steel,Rajratan Global Wire is engaged in the Business of Manufacture of Steel Wires.
530919,Magal Automotive Ltd,remsons.com,530919,REMSONSIND,Auto Ancillaries,Auto Ancillaries,Remsons Industries Limited is engaged in the manufacturing and designing of auto control cables and gear shifters.
532443,Cera Sanitaryware Ltd,cera-india.com,532443,CERA,Ceramics - Tiles / Sanitaryware,Ceramic Products,"Cera Sanitaryware is engaged in the business of manufacturing, selling and trading of building products and is having nonconventional wind & solar power for captive use in the State of Gujarat."
522295,Control Print Ltd,controlprint.com,522295,CONTROLPR,Packaging,Packaging,Control Print is engaged in manufacturing and supplying of Coding & Marking Machines and its related consumables. It has country wide service network to cater its customers.
533608,RDB Rasayans Ltd,rdbgroup.in,533608,,Textiles - Manmade,Textiles,RDB Rasayans Limited is a manufacturer and exporter of bulk packaging in Eastern India. The Company is primarily engaged and focused on the business of manufacturing of polymer-based woven sack.
526947,La Opala RG Ltd,laopala.in,526947,LAOPALA,Glass & Glass Products,Glass & Glass Products,La Opala RG is engaged in the Business of Manufacture of Table or Kitchen Glassware.
NSE : ICEMAKE,ICE Make Refrigeration Ltd,Company website,NSE : ICEMAKE,,Engineering,Engineering,"ICE Make Refrigeration is engaged in the business of manufacturing of Cold Rooms, Freezer, Refrigeration System and Chilling Plant etc."
532663,Sasken Technologies Ltd,sasken.com,532663,SASKEN,Computers - Software - Medium / Small,IT - Software,"Sasken Technologies is a specialist in Product Engineering and Digital Transformation providing concept-to-market, chip-to-cognition R&D services to global leaders in Semiconductor, Automotive, Industrials, Smart Devices & Wearables, Enterprise Grade Devices, SatCom, and Transportation industries.(Source : 201903 Annual Report Page No: 74)"
531254,Optimus Finance Ltd,optimusfinance.in,531254,,Finance & Investments,Finance,Optimus Finance Ltd is engaged in investment and trading in marketable securities and mutual funds.
500067,Blue Star Ltd,bluestarindia.com,500067,BLUESTARCO,Air-conditioners,Consumer Durables,"Blue Star is primarily engaged in the business of manufacturing and installation of air conditioning units, commercial refrigeration units, water and air purifiers and air coolers."
532468,Kama Holdings Ltd,kamaholdings.com,532468,,Finance & Investments,Finance,"KAMA Holdings Limited engages in the technical textiles, chemicals and polymers, and packaging film businesses in India and internationally."
513375,Carborundum Universal Ltd,cumi.murugappa.com,513375,CARBORUNIV,Abrasives And Grinding Wheels,Capital Goods-Non Electrical Equipment,"Carborundum Universal is a manufactures and sells mainly Abrasives, Ceramics (Industrial Ceramics, Refractories) and Electrominerals."
532927,eClerx Services Ltd,eclerx.com,532927,ECLERX,Computers - Software - Medium / Small,IT - Software,"eClerx Services is engaged in the business in worlds leading companies across financial services, cable and telecommunications, retail, fashion, media & entertainment, manufacturing, travel and leisure, software and hightech."
505790,Schaeffler India Ltd,schaeffler.co.in,505790,SCHAEFFLER,Bearings,Bearings,"Schaeffler India is engaged in the development, manufacturing and distribution of high-precision roller and ball bearings, engine systems and transmission components, chassis applications and related machine building manufacturing activities."
500233,Kajaria Ceramics Ltd,kajariaceramics.com,500233,KAJARIACER,Ceramics - Tiles / Sanitaryware,Ceramic Products,"Kajaria Ceramics is Manufacturing & trading of Ceramic Wall and Floor Tiles, Polished and Glazed Vitrified Tiles."
533022,20 Microns Ltd,20microns.com,533022,20MICRONS,Mining / Minerals / Metals,Mining & Mineral products,20 Microns is engaged in Business of Industrial Micronised Minerals and Speciality Chemicals.(Source : 201903 Annual Report Page No: 75)
532430,BF Utilities Ltd,bfutilities.com,532430,BFUTILITIE,Power Generation And Supply,Power Generation & Distribution,BF Utilities is an India-based holding company. The Company is engaged in the business of wind power generation. The Company operates through two segments: Wind energy and Infrastructure.
524804,Aurobindo Pharma Ltd,aurobindo.com,524804,AUROPHARMA,Pharmaceuticals - Indian - Bulk Drugs & Formln,Pharmaceuticals,Aurobindo Pharma is engaged in the Business of Manufacturing generic pharmaceuticals and Active Pharmaceutical Ingredients.
534091,Multi Commodity Exchange of India Ltd,mcxindia.com,534091,MCX,Miscellaneous,Miscellaneous,Multi Commodity Exchange of India is engaged in the business of Facilitating Trading of Commodity Derivatives.
524748,Link Pharma Chem Ltd,linkpharmachem.co.in,524748,,Chemicals,Chemicals,"Link Pharma Chem is engaged in the manufacturing and selling of organic intermediates which are used in pharmaceuticals, agro and speciality chemical industries."
504918,Sandur Manganese & Iron Ores Ltd,sandurgroup.com,504918,,Mining / Minerals / Metals,Mining & Mineral products,Sandur Manganese & Iron Ores is engaged in mining of Manganese and iron ore.
523367,DCM Shriram Ltd,dcmshriram.com,523367,DCMSHRIRAM,Diversified - Mega,Diversified,"DCM Shriram is engaged in the business of Manufacture of Chemicals and Fertilisers,Trade of Agri-inputs,Manufacture of Cement ,Sugar ,Seed Processing Activities, Research Activities,UPVC Window Systems and Co-generation of Power."
540715,Sagar Diamonds Ltd,sagardiamonds.com,540715,,Diamond Cutting / Jewellery,"Diamond, Gems and Jewellery","Diamond, Gems and Jewellery >> Diamond Cutting / Jewellery"
532424,Godrej Consumer Products Ltd,godrejcp.com,532424,GODREJCP,Personal Care - Indian,FMCG,"Godrej Consumer Products is engaged in the business of manufacturing of personal, household and hair care products."
532683,AIA Engineering Ltd,aiaengineering.com,532683,AIAENG,Castings & Forgings,"Castings, Forgings & Fastners","AIA Engineering is engaged in one of the worlds leading manufacturers of value-added, impact abrasion, and corrosion resistant High Chrome Mill Internals (HCMI).(Source : 201903 Annual Report Page No: 04)"
NSE - SM : ZODIAC,Zodiac Energy Ltd,zodiacenergy.com,NSE - SM : ZODIAC,,Engineering - Turnkey Services,Infrastructure Developers & Operators,Zodiac Energy is engaged in the business of installation of Power Generation Plant/Items.(Source : 201803 Annual Report Page No:43)
524828,BDH Industries Ltd,bdhind.com,524828,,Pharmaceuticals - Indian - Formulations,Pharmaceuticals,BDH Industries is engaged in manufacturing of therapeutic formulations covering wide range of pharmaceuticals.
539098,Filtra Consultants & Engineers Ltd,filtra.in,539098,,Engineering,Capital Goods-Non Electrical Equipment,"Filtra Consultants & Engineers is engaged in in Trading and Manufacturing Activity of Water Treatment system Business such as Membrane, Multi port Valve, Cartridge, Vessels, Tank, Pump, Ph Meter, Orp Meter, Etc.,(Source : 201903 Annual Report Page No: 84)"
500171,GHCL Ltd,ghclindia.com,500171,GHCL,Chemicals,Chemicals,"GHCL is engaged in primarily two segments consisting of Inorganic Chemicals (mainly manufacture and sale of Soda Ash) and Home Textile division (comprising of yarn manufacturing, weaving, processing and cutting and sewing of home textiles products)."
NSE - SM : KAPSTON,Kapston Facilities Management Ltd,Company website,NSE - SM : KAPSTON,,Miscellaneous,Miscellaneous,Miscellaneous >> Miscellaneous
539523,Alkem Laboratories Ltd,alkemlabs.com,539523,ALKEM,Pharmaceuticals - Indian - Bulk Drugs & Formln,Pharmaceuticals,"Alkem Laboratories is engaged in the Business of development, manufacture and sale of pharmaceutical and nutraceutical products."
533179,Persistent Systems Ltd,persistent.com,533179,PERSISTENT,Computers - Software - Medium / Small,IT - Software,"Persistent Systems is a global company specializing in software products, services and technology innovation. The Company offers complete product life cycle services."
500319,Indian Sucrose Ltd,muksug.com,500319,,Sugar,Sugar,"Indian Sucrose Limited is an India-based company, which engages in the manufacturing and refining of sugar."
company_id,name,link,bse,nse,industry,sector,about
500235,Kalyani Steels Ltd,kalyanisteels.com,500235,KSL,Steel - Medium / Small,Steel,Kalyani Steels is primarily engaged in the business of manufacture and sale of Iron and Steel Products.(Source : 201903 Annual Report Page No: 54)
company_id,name,link,bse,nse,industry,sector,about
